{
  "version": "1",
  "job_id": "7f2c9a4b8d1e3f6021aa5c7e9b0d4f83",
  "status": "completed",
  "created_at": "2026-09-18T08:14:02+00:00",
  "updated_at": "2026-09-18T08:21:47+00:00",
  "source": {
    "filename": "zapis-soveshchaniya-demo.ogg",
    "sha256": "c05f1d2ab34e5678901234567890abcdef1234567890abcdef1234567890abcd",
    "mime": "audio/ogg",
    "duration": 2743.0,
    "size": 4123456
  },
  "segments": [
    {
      "id": 0,
      "start": 0.0,
      "end": 900.0,
      "status": "done",
      "text": "Добрый день, начнём с обзора полевых работ. Участок у реки прошёл обработку во вторник, расход составил двести десять литров на гектар. [неразборчиво] на поворотной полосе.",
      "warnings": ["unclear_markers: 1"]
    },
    {
      "id": 1,
      "start": 896.0,
      "end": 1800.0,
      "status": "done",
      "text": "расход составил двести десять литров на гектар. По технике: у второго опрыскивателя заменили форсунки, заявка номер сорок пять двенадцать.",
      "warnings": []
    },
    {
      "id": 2,
      "start": 1796.0,
      "end": 2743.0,
      "status": "done",
      "text": "Итоги недели записаны, план на следующую обсудим в четверг. Запись окончена.",
      "warnings": []
    }
  ],
  "transcript": "# Границы вида [SEG n] ЧЧ:ММ:СС–ЧЧ:ММ:СС — измеренные границы нарезки, не отметки модели.\n\n[SEG 0] 00:00:00–00:15:00\nДобрый день, начнём с обзора полевых работ. Участок у реки прошёл обработку во вторник, расход составил двести десять литров на гектар. [неразборчиво] на поворотной полосе.\n\n[SEG 1] 00:14:56–00:30:00\nПо технике: у второго опрыскивателя заменили форсунки, заявка номер сорок пять двенадцать.\n\n[SEG 2] 00:29:56–00:45:43\nИтоги недели записаны, план на следующую обсудим в четверг. Запись окончена.",
  "structured_draft": {
    "summary": "Обсуждены полевые работы: обработка участка у реки во вторник с расходом 210 л/га, ремонт второго опрыскивателя (замена форсунок, заявка №4512) и план следующей встречи в четверг.",
    "topics": [
      {"title": "Полевые работы и расход препаратов", "segments": [0, 1]},
      {"title": "Ремонт техники", "segments": [1]},
      {"title": "Планирование", "segments": [2]}
    ],
    "statements": [
      {"text": "Участок у реки обработан во вторник.", "segments": [0], "confidence": "supported"},
      {"text": "Расход составил 210 литров на гектар.", "segments": [0, 1], "confidence": "supported"},
      {"text": "У второго опрыскивателя заменены форсунки по заявке №4512.", "segments": [1], "confidence": "supported"}
    ],
    "questionable_places": [
      {"issue": "Фрагмент о поворотной полосе неразборчив", "segments": [0], "quote": "[неразборчиво] на поворотной полосе"}
    ],
    "speakers_note": "Говорящие не названы по имени: один основной докладчик."
  },
  "warnings": [
    "segment 0: unclear_markers: 1",
    "overlap_dedup: стык 0/1 — удалено 1 дублированных строк(и) перекрытия"
  ],
  "provenance": {
    "model": "demo-model-name",
    "transcribe_prompt_version": "transcribe-v1",
    "structure_prompt_version": "structure-v1",
    "structure_merge_prompt_version": "structure-merge-v1",
    "segment_seconds": 900.0,
    "overlap_seconds": 4.0,
    "audio_pipeline": "ffmpeg mono 16kHz Opus 24k OGG",
    "transport": "HttpTransport",
    "language": "ru",
    "vocabulary_terms": 2
  },
  "error": null
}
